[
  {
    "rule_id": "urn:odgs:rule:ai_accuracy_threshold_01",
    "name": "ML Model Drift and Accuracy Limit",
    "domain": "AI Governance",
    "calculation_logic": "ABS(Current_Accuracy - Baseline_Accuracy) < 0.05",
    "owner": "AI Governance Committee"
  },
  {
    "rule_id": "urn:odgs:rule:gdpr_anonymization_logistics",
    "name": "PII Masking Rule for Telematics",
    "domain": "Privacy",
    "calculation_logic": "CASE WHEN role != 'SAFETY_OFFICER' THEN SHA2(driver_id, 256) ELSE driver_id END",
    "owner": "DPO"
  },
  {
    "rule_id": "urn:odgs:rule:bias_mitigation_routing",
    "name": "Geospatial Bias Validation",
    "domain": "Ethics",
    "calculation_logic": "Variance(ETA_Error) across Socio-Economic Zones < 0.1",
    "owner": "Ethics Lead"
  }
]